,cleaned_text,cleaned_summary
0,bought several vitality canned dog food products found good quality product looks like stew processed meat smells better labrador finicky appreciates product better,good quality dog food
1,product arrived labeled jumbo salted peanuts peanuts actually small sized unsalted sure error vendor intended represent product jumbo,not as advertised
2,confection around centuries light pillowy citrus gelatin nuts case filberts cut tiny squares liberally coated powdered sugar tiny mouthful heaven chewy flavorful highly recommend yummy treat familiar story lewis lion witch wardrobe treat seduces edmund selling brother sisters witch,delight says it all
3,looking secret ingredient robitussin believe found got addition root beer extract ordered made cherry soda flavor medicinal,cough medicine
4,great taffy great price wide assortment yummy taffy delivery quick taffy lover deal,great taffy
5,got wild hair taffy ordered five pound bag taffy enjoyable many flavors watermelon root beer melon peppermint grape etc complaint bit much red black licorice flavored pieces kids husband lasted two weeks would recommend brand taffy delightful treat,nice taffy
6,saltwater taffy great flavors soft chewy candy individually wrapped well none candies stuck together happen expensive version fralinger would highly recommend candy served beach themed party everyone loved,great just as good as the expensive brands
7,taffy good soft chewy flavors amazing would definitely recommend buying satisfying,wonderful tasty taffy
8,right mostly sprouting cats eat grass love rotate around wheatgrass rye,yay barley
9,healthy dog food good digestion also good small puppies dog eats required amount every feeding,healthy dog food
10,know cactus tequila unique combination ingredients flavour hot sauce makes one kind picked bottle trip brought back home us totally blown away realized simply could find anywhere city bummed magic internet case sauce ecstatic love hot sauce mean really love hot sauce want sauce tastelessly burns throat grab bottle tequila picante gourmet de inclan realize taste never want use sauce thank personal incredible service,the best hot sauce in the world
11,one boys needed lose weight put food floor chubby guy protein rich product food higher skinny boy jump higher food sits going stale really go food chubby boy losing ounce week,my cats love this diet food better than their regular food
12,cats happily eating felidae platinum two years got new bag shape food different tried new food first put bowls bowls sit full kitties touch food noticed similar reviews related formula changes past unfortunately need find new food cats eat,my cats are not fans of the new food
13,good flavor came securely packed fresh delicious love twizzlers,fresh and greasy
14,strawberry twizzlers guilty pleasure yummy six pounds around son,strawberry twizzlers yummy
15,daughter loves twizzlers shipment six pounds really hit spot exactly would expect six packages strawberry twizzlers,lots of twizzlers just what you expect
16,love eating good watching tv looking movies sweet like transfer zip lock baggie stay fresh take time eating,poor taste
17,satisfied twizzler purchase shared others enjoyed definitely ordering,love it
18,twizzlers strawberry childhood favorite candy made lancaster pennsylvania candies inc one oldest confectionery firms united states subsidiary hershey company company established young smylie also make apple licorice twists green color blue raspberry licorice twists like alli keep dry cool place recommended put fridge according guinness book records longest licorice twist ever made measured feet weighted pounds made candies inc record breaking twist became guinness world record july product kosher thank,great sweet candy
19,candy delivered fast purchased reasonable price home bound unable get store perfect,home delivered twizlers
20,husband twizzlers addict bought many times amazon government employees living overseas cannot get country assigned always fresh tasty packed well arrive timely manner,always fresh
21,bought husband currently overseas loves apparently staff likes also generous amounts twizzlers ounce bag well worth price twizzlers strawberry ounce bags,twizzlers
22,remember buying candy kid quality dropped years still superb product disappointed,delicious product
23,love candy weight watchers cut back still craving,twizzlers
24,lived us yrs miss twizzlers go back visit someone visits always stock say yum sell mexico faithful buyer often able buy right,please sell these in mexico
25,product received advertised twizzlers strawberry ounce bags,twizzlers strawberry
26,candy red flavor plan chewy would never buy,nasty no flavor
27,glad amazon carried batteries hard time finding elsewhere unique size need garage door opener great deal price,great bargain for the price
28,got mum diabetic needs watch sugar intake father simply chooses limit unnecessary sugar intake one sweet tooth loved toffees would never guess sugar free great eat pretty much guilt free impressed ordered take office eat instead snacking sugary sweets excellent,yummy
30,never huge coffee fan however mother purchased little machine talked trying latte macciato coffee shop better one like products little dolche guesto machine super easy use prepares really good coffee latte cappuccino etc less minute would recommend dolce gusto anyone good price getting one,great machine
31,offer great price great taste thanks amazon selling product staral,this is my taste
32,mccann instant oatmeal great must oatmeal scrape together two three minutes prepare escaping fact however even best instant oatmeal nowhere near good even store brand oatmeal requiring stovetop preparation still mccann good gets instant oatmeal even better organic natural brands tried varieties mccann variety pack taste good prepared microwave adding boiling water convenient extreme time issue mccann use actual cane sugar instead high fructose corn syrup helped decide buy product real sugar tastes better harmful stuff one thing like though mccann use thickeners oats plus water plus heat make creamy tasty oatmeal without need guar gum convenience product maybe guar gum sitting bowl instant mccann becomes thick gluey,best of the instant oatmeals
33,good instant oatmeal best oatmeal brand uses cane sugar instead high fructouse corn syrup better sweetness doctors say form sugar better great cold morning time make mccann steel cut oats apple cinnamon best maple brown sugar regular good plus require doctoring actually tell three flavors apart,good instant
34,instant oatmeal become soggy minute water hits bowl mccann instant oatmeal holds texture excellent flavor good time mccann regular oat meal excellent may take bit longer prepare time morning best instant brand ever eaten close second non instant variety mccann instant irish oatmeal variety pack regular apples cinnamon maple brown sugar count boxes,great irish oatmeal for those in hurry
35,mccann instant irish oatmeal variety pack regular apples cinnamon maple brown sugar count boxes fan mccann steel cut oats thought would give instant variety try found hardy meal sweet great folks like need food palatable easily digestible fiber make bloat,satisfying
36,us celiac disease product lifesaver could better getting almost half price grocery health food store love mccann instant oatmeal flavors thanks abby,love gluten free oatmeal
37,else need know oatmeal instant expensive kroger store brand oatmeal maybe little tastier better texture something still oatmeal mm convenient,it is oatmeal
38,visiting friend nate morning coffee came storage room suggested try use stash sometimes nate dose give chance say ended trying apple cinn found tastefull made water powdered milk goes good coffee slice toast ready take world day least jerry reith,good way to start the day
39,ordered wife reccomended daughter almost every morning likes flavors happy happy mccann instant irish oatmeal variety pack regular apples cinnamon maple brown sugar count boxes,wife favorite breakfast
40,variety packs taste great every morning cents per meal understand everyone earth buying stuff maple brown sugar terrific followed apples cinnamon followed regular get tired ole thing taste great boil water small pot empty packet bowl pour boiling water watch expand size taste really good takes minutes prepare sure everyone earth convenient healthy quick excellent quality extremely cheap,why would not you buy oatmeal from mcanns tastes great
41,mccann makes oatmeal every oatmeal connoisseur whether one likes raw pellet state cooks half hour sloth addled instant done microwave three minutes good sure beauty instant variety available different flavors well regular variety pack allows different tastes explored well giving chance experience difference mccann well known oatmeals personally like mccann cooks thicker body top brand america apples cinnamon though tends little liquidy may want experiment amount water add watt microwave oatmeal cooks one minute twenty seven seconds also watch get handle much time water use bad thing consider bad thing offering buy lot end six ten count boxes good whole family oatmeal eaters single person alone well love oatmeal,oatmeal for oatmeal lovers
42,mccann oatmeal every morning ordering amazon able save almost per box great product tastes great healthy,food great
43,mccann oatmeal good quality choice favorite apples cinnamon find none overly sugary good hot breakfast minutes excellent,good hot breakfast
44,really like mccann steel cut oats find cook often tastes much better grocery store brands convenient anything keeps eating oatmeal regularly good thing,great taste and convenience
45,seems little wholesome supermarket brands somewhat mushy quite much flavor either pass muster kids probably buy,hearty oatmeal
46,good oatmeal like apple cinnamon best though would follow directions package since always comes soupy taste could since like oatmeal really thick add milk top,good
47,flavors good however see differce oaker oats brand mushy,mushy
48,really like maple brown sugar flavor regular fine brown sugar added apples cinnamon flavor ok quick easy satisfying breakfast order brand variety get maple brown sugar,very good but next time will not order the variety pack
49,stuff buy big box stores nothing healthy carbs sugars save money get something least taste,same stuff
